{
  "schema_version": "v19.0",
  "run_id": "RUN-29e97062122c",
  "delivery_status": "not_queued",
  "attachments": [],
  "local_paths_exposed": false,
  "artifact_ready_claim_allowed": false,
  "external_delivery_claim_allowed": false,
  "stub_delivery_disclosure_required": false,
  "provider_capability_snapshot": {},
  "real_external_delivery": false,
  "stub_delivery": false,
  "created_at": "2026-05-08T15:14:47Z",
  "job_id": "JOB-432935a0b3bf"
}
